{
  "schema": "agentproof.protocol.prepared-repository-patch",
  "schemaVersion": "1.0.0",
  "actionType": "agentproof.repository_patch.v1",
  "correlationId": "workflow-correlation-99999999",
  "transactionId": "86b2e09c-441c-40c3-b9ff-7637a0b1e53a",
  "stateDirectory": "/tmp/agentproof-rc3-fixtures-eBXAm2/state",
  "actionDigest": "0c52b4091cdd498f7af921075aa357887eb016cc1355d316bc88e92476f0719b",
  "patchDigest": "8ee1391e9fab06d33f201ea4b098f115e372b9a5ddcd1e3475e868a983ec2b2f",
  "preparedDigest": "8741367b95726234fb988680289e9993beff50e03322f9fdaa840e69f7baf05b",
  "state": "prepared"
}
